Author,Title,Abstract,Journal,Year,AI_Techniques,Sports,AI_for_Injury_Risk,AI_for_Sporting_Performance
"Wang Y, Zhao Y, Chan RHM, et al",Volleyball skill assessment using a single wearable micro inertial measurement unit at wrist,,,,[],['volleyball'],False,False
"Pai PF, ChangLiao LH, Lin KP",Analyzing basketball games by a support vector machines with decision tree model,,,,['Decision Tree Classifier'],['basketball'],False,False
"Qilin S, Xiaomei W, Xiaoling F, et al",Study on knee joint injury in college football training based on artificial neural network,,,,['Artificial Neural Network'],[],False,False
"Adetiba E, Iweanya VC, Popoola SI, et al",Automated detection of heart defects in athletes based on electrocardiography and artificial neural network,,,,['Artificial Neural Network'],[],False,False
"Ertelt T, Solomonovs I, Gronwald T",Enhancement of force patterns classification based on Gaussian distributions,"Description of the patterns of ground reaction force is a standard method in areas such as medicine, biomechanics and robotics. The fundamental parameter is the time course of the force, which is classified visually in particular in the field of clinical diagnostics. Here, the knowledge and experience of the diagnostician is relevant for its assessment. For an objective and valid discrimination of the ground reaction force pattern, a generic method, especially in the medical field, is absolutely necessary to describe the qualities of the time-course. The aim of the presented method was to combine the approaches of two existing procedures from the fields of machine learning and the Gauss approximation in order to take advantages of both methods for the classification of ground reaction force patterns. The current limitations of both methods could be eliminated by an overarching method. Twenty-nine male athletes from different sports were examined. Each participant was given the task of performing a one-legged stopping maneuver on a force plate from the maximum possible starting speed. The individual time course of the ground reaction force of each subject was registered and approximated on the basis of eight Gaussian distributions. The descriptive coefficients were then classified using Bayesian regulated neural networks. The different sports served as the distinguishing feature. Although the athletes were all given the same task, all sports referred to a different quality in the time course of ground reaction force. Meanwhile within each sport, the athletes were homogeneous. With an overall prediction (R = 0.938) all subjects/sports were classified correctly with 94.29% accuracy. The combination of the two methods: the mathematical description of the time course of ground reaction forces on the basis of Gaussian distributions and their classification by means of Bayesian regulated neural networks, seems an adequate and promising method to discriminate the ground reaction forces without any loss of information.",Journal of biomechanics,2018.0,['Artificial Neural Network'],[],False,False
Ge S,Research on the factors of basketball injury in physical teaching based on artificial neural network,"Cancer stem-like cells (CSC) play pivotal roles in both chemoresistance and recurrence of many cancer types, including urothelial bladder cancer (UBC). In addition to intrinsic signaling pathways, extracellular cues from the tumor microenvironment (TME) are indispensable for the maintenance of CSCs. To better understand the mechanisms involved in TME-mediated generation and support of UBC CSCs, we focused on the role of cancer-associated fibroblasts (CAF) in this study. Overexpression of miR-146a-5p in CAFs promoted CAF-to-UBC cell interactions, cancer stemness, and chemoresistance to treatment with gemcitabine and cisplatin. Mechanistically, miR-146-5p upregulated SVEP1 in CAFs by enhancing the recruitment of transcriptional factor YY1. Meanwhile, by targeting the 3'UTR of mRNAs of ARID1A and PRKAA2 (also known as AMPKα2) in UBC cells, CAF-secreted miR-146a-5p promoted cancer stemness and chemoresistance. Downregulation of ARID1A resulted in the inhibition of SOCS1 and subsequent STAT3 activation, and downregulated PRKAA2 led to the activation of mTOR signaling. Elevated levels of exosomal miR-146a-5p in the serum of patients with UBC were correlated with both tumor stage and relapse risk. These findings altogether indicate that CAF-derived miR-146a-5p can promote stemness and enhance chemoresistance in UBC. Exosomal miR-146a-5p may be a biomarker of UBC recurrence and a potential therapeutic target.",Cancer research,2023.0,['Artificial Neural Network'],['basketball'],False,False
"Bartlett JD, O ’Connor F, Pitchford N, et al",Relationships between internal and external training load in team-sport athletes: evidence for an individualized approach,The aim of this study was to quantify and predict relationships between rating of perceived exertion (RPE) and GPS training-load (TL) variables in professional Australian football (AF) players using group and individualized modeling approaches.,International journal of sports physiology and performance,2017.0,[],['australian football'],False,False
"Kautz T, Groh BH, Hannink J, et al",Activity recognition in beach volleyball using a deep convolutional neural network,,,,['Artificial Neural Network'],['volleyball'],False,False
"Pensgaard AM, Ivarsson A, Nilstad A, et al","Psychosocial stress factors, including the relationship with the coach, and their influence on acute and overuse injury risk in elite female football players","The relationship between specific types of stressors (eg, teammates, coach) and acute versus overuse injuries is not well understood.",BMJ open sport & exercise medicine,2018.0,[],[],True,False
"Ruddy JD, Shield AJ, Maniar N, et al",Predictive modeling of hamstring strain injuries in elite Au stralian Footballers,"Three of the most commonly identified hamstring strain injury (HSI) risk factors are age, previous HSI, and low levels of eccentric hamstring strength. However, no study has investigated the ability of these risk factors to predict the incidence of HSI in elite Australian footballers. Accordingly, the purpose of this prospective cohort study was to investigate the predictive ability of HSI risk factors using machine learning techniques.",Medicine and science in sports and exercise,2018.0,[],['australian football'],False,False
"Rossi A, Pappalardo L, Cintia P, et al",Effective injury forecasting in soccer with GPS training data and machine learning,"Injuries have a great impact on professional soccer, due to their large influence on team performance and the considerable costs of rehabilitation for players. Existing studies in the literature provide just a preliminary understanding of which factors mostly affect injury risk, while an evaluation of the potential of statistical models in forecasting injuries is still missing. In this paper, we propose a multi-dimensional approach to injury forecasting in professional soccer that is based on GPS measurements and machine learning. By using GPS tracking technology, we collect data describing the training workload of players in a professional soccer club during a season. We then construct an injury forecaster and show that it is both accurate and interpretable by providing a set of case studies of interest to soccer practitioners. Our approach opens a novel perspective on injury prevention, providing a set of simple and practical rules for evaluating and interpreting the complex relations between injury risk and training performance in professional soccer.",PloS one,2018.0,[],['soccer'],True,False
"Thornton HR, Delaney JA, Duthie GM, et al",Importance of various training- load measures in injury incidence of professional Rugby League athletes,To investigate the ability of various internal and external training-load (TL) monitoring measures to predict injury incidence among positional groups in professional rugby league athletes.,International journal of sports physiology and performance,2017.0,[],['rugby'],False,False
"Jaspers A, De Beéck TO, Brink MS, et al",Relationships between the external and internal training load in professional soccer: what can we learn from machine learning? Int J Sports Physiol Perform,"In professional senior soccer, training load monitoring is used to ensure an optimal workload to maximize physical fitness and prevent injury or illness. However, to date, different training load indicators are used without a clear link to training outcomes.","Sports medicine (Auckland, N.Z.)",2017.0,[],['soccer'],False,False
"Goswami R, Dufort P, Tartaglia MC, et al",Frontotemporal correlates of impulsivity and machine learning in retired professional athletes with a history of multiple concussions,"The frontotemporal cortical network is associated with behaviours such as impulsivity and aggression. The health of the uncinate fasciculus (UF) that connects the orbitofrontal cortex (OFC) with the anterior temporal lobe (ATL) may be a crucial determinant of behavioural regulation. Behavioural changes can emerge after repeated concussion and thus we used MRI to examine the UF and connected gray matter as it relates to impulsivity and aggression in retired professional football players who had sustained multiple concussions. Behaviourally, athletes had faster reaction times and an increased error rate on a go/no-go task, and increased aggression and mania compared to controls. MRI revealed that the athletes had (1) cortical thinning of the ATL, (2) negative correlations of OFC thickness with aggression and task errors, indicative of impulsivity, (3) negative correlations of UF axial diffusivity with error rates and aggression, and (4) elevated resting-state functional connectivity between the ATL and OFC. Using machine learning, we found that UF diffusion imaging differentiates athletes from healthy controls with significant classifiers based on UF mean and radial diffusivity showing 79-84 % sensitivity and specificity, and 0.8 areas under the ROC curves. The spatial pattern of classifier weights revealed hot spots at the orbitofrontal and temporal ends of the UF. These data implicate the UF system in the pathological outcomes of repeated concussion as they relate to impulsive behaviour. Furthermore, a support vector machine has potential utility in the general assessment and diagnosis of brain abnormalities following concussion.",Brain structure & function,2016.0,[],[],False,False
"Wu LC, Kuo C, Loza J, et al",Detection of American football head impacts using biomechanical features and support vector machine classification,"Accumulation of head impacts may contribute to acute and long-term brain trauma. Wearable sensors can measure impact exposure, yet current sensors do not have validated impact detection methods for accurate exposure monitoring. Here we demonstrate a head impact detection method that can be implemented on a wearable sensor for detecting field football head impacts. Our method incorporates a support vector machine classifier that uses biomechanical features from the time domain and frequency domain, as well as model predictions of head-neck motions. The classifier was trained and validated using instrumented mouthguard data from collegiate football games and practices, with ground truth data labels established from video review. We found that low frequency power spectral density and wavelet transform features (10~30 Hz) were the best performing features. From forward feature selection, fewer than ten features optimized classifier performance, achieving 87.2% sensitivity and 93.2% precision in cross-validation on the collegiate dataset (n = 387), and over 90% sensitivity and precision on an independent youth dataset (n = 32). Accurate head impact detection is essential for studying and monitoring head impact exposure on the field, and the approach in the current paper may help to improve impact detection performance on wearable sensors.",Scientific reports,2017.0,[],['american football'],False,False
"Whiteside D, Martini DN, Lepley AS, et al",Predictors of ulnar collateral ligament reconstruction in Major League Baseball pitchers,"Ulnar collateral ligament (UCL) reconstruction surgeries in Major League Baseball (MLB) have increased significantly in recent decades. Although several risk factors have been proposed, a scientific consensus is yet to be reached, providing challenges to those tasked with preventing UCL injuries.",The American journal of sports medicine,2016.0,[],['baseball'],False,False
